{
  "$schema": "https://json-schema.org/draft/2020-12/schema",
  "$id": "https://github.com/Rearctor/reaction-modules/specs/module-manifest.schema.json",
  "title": "Reaction Module Manifest (draft)",
  "description": "DRAFT. Describes a single module declared against a Rearctor reaction at Spark. Field names, value domains and constraints are under research and are not final. This schema does not describe an implemented system.",
  "type": "object",
  "required": ["module_id", "version", "type", "allocation_bps", "activation_stage", "execution_mode"],
  "additionalProperties": false,
  "properties": {
    "module_id": {
      "type": "string",
      "description": "Stable identifier for this module within the reaction's declared set. Unique per reaction.",
      "pattern": "^[a-z][a-z0-9-]{2,63}$"
    },
    "version": {
      "type": "string",
      "description": "Draft revision of the manifest format this object targets. Not a released version number.",
      "pattern": "^0[.][0-9]+$"
    },
    "type": {
      "type": "string",
      "description": "Module semantics. Closed set: arbitrary user-supplied behaviour is an explicit non-goal.",
      "enum": [
        "automated-buyback",
        "liquidity-reinvestment",
        "creator-vesting",
        "holder-rewards",
        "referral-allocation",
        "treasury-allocation"
      ]
    },
    "allocation_bps": {
      "type": "integer",
      "description": "Claim on the reaction allocation, in basis points of that allocation (not of total fees). Whether a module set must sum to 10000 is an open question.",
      "minimum": 1,
      "maximum": 10000
    },
    "activation_stage": {
      "type": "string",
      "description": "Earliest reaction stage at which this module may execute. Declaration always occurs at Spark regardless of this value.",
      "enum": ["charging", "ignition", "expansion"]
    },
    "execution_mode": {
      "type": "string",
      "description": "How execution is initiated. 'manual' requires an administrative call; 'scheduled' fires on declared conditions; 'continuous' settles on every qualifying fee event.",
      "enum": ["manual", "scheduled", "continuous"]
    },
    "hard_budget_ceiling": {
      "type": ["object", "null"],
      "description": "Optional absolute upper bound, independent of allocation_bps. Treated as a ceiling, never a target. Null means no ceiling beyond the bps claim.",
      "required": ["denomination", "amount"],
      "additionalProperties": false,
      "properties": {
        "denomination": { "type": "string", "enum": ["USDC", "REACTION_TOKEN"] },
        "amount": {
          "type": "string",
          "description": "Base-unit integer as a decimal string, to avoid float precision loss.",
          "pattern": "^[0-9]+$"
        }
      }
    },
    "parameters": {
      "type": "object",
      "description": "Type-specific configuration. Intentionally loose in this draft; per-type schemas are under research.",
      "additionalProperties": true
    },
    "immutable_fields": {
      "type": "array",
      "description": "Fields the creator asserts are frozen at deployment. Under research: this may become implicit in the format rather than declared per manifest.",
      "items": { "type": "string" },
      "uniqueItems": true
    },
    "notes": {
      "type": "string",
      "description": "Free-text rationale. Not interpreted.",
      "maxLength": 2000
    }
  }
}
